{
  "schema_version": "1.0.0",
  "stable_key": "fresh-bananas-2026-08-07-full-location",
  "name": "Fresh Bananas — August 7, 2026 full-location replay",
  "captured_at": "2026-08-07T05:16:26Z",
  "product_pack": {
    "id": "fresh_bananas",
    "version": "1.1.0"
  },
  "analysis_config": {
    "id": "historical-fresh-bananas-2026-08-07",
    "name": "Historical Fresh Bananas — August 7, 2026",
    "version": "1.0.0",
    "enabled": true,
    "benchmark_retailer": "walmart_us",
    "product_pack": {
      "id": "fresh_bananas",
      "version": "1.1.0"
    },
    "retailers": [
      { "retailer_id": "walmart_us", "enabled": true },
      { "retailer_id": "aldi_us", "enabled": true },
      { "retailer_id": "amazon_us_same_day", "enabled": true }
    ],
    "analysis": {
      "comparison_profiles": [
        "strict_each",
        "weight_normalized",
        "count_compatible",
        "conventional_bunch_range",
        "organic_bunch_package",
        "organic_bunch_midpoint"
      ],
      "enable_ai_fallback": false,
      "enable_proximity_validation": false
    },
    "delivery": {
      "web_report": true,
      "excel": true,
      "leadership_email": true,
      "audit_package": true
    }
  },
  "artifacts": [
    {
      "ordinal": 0,
      "retailer_id": "walmart_us",
      "adapter_id": "historical_metricscart_search_monitor_csv",
      "source_name": "Bananas___Walmart_All_Stores_20260807_051626.csv",
      "source_format": "metricscart_search_monitor_csv",
      "content_type": "text/csv",
      "expected_sha256": "3351a7453ee2e40366f71566e86e13d211173f454c2ed5f1b461956699dca68a",
      "expected_rows": 96994
    },
    {
      "ordinal": 1,
      "retailer_id": "aldi_us",
      "adapter_id": "historical_metricscart_search_monitor_csv",
      "source_name": "Bananas___Aldi_All_Stores_20260807_051549.csv",
      "source_format": "metricscart_search_monitor_csv",
      "content_type": "text/csv",
      "expected_sha256": "d0163669e24a1322dbab7eec336558160250f8278b185bdbf487297b0ce330c0",
      "expected_rows": 4429
    },
    {
      "ordinal": 2,
      "retailer_id": "amazon_us_same_day",
      "adapter_id": "historical_metricscart_consolidated_serp_csv",
      "source_name": "bananas_amazon.csv",
      "source_format": "metricscart_consolidated_serp_csv",
      "content_type": "text/csv",
      "expected_sha256": "46f20d56b435870d2d618db9d7e95b30beb70fdc1b7c6cacad89942fec8df1ca",
      "expected_rows": 67017
    }
  ],
  "metadata": {
    "source_rows_total": 168440,
    "purpose": "Full-source fresh banana golden replay"
  }
}
