{
  "schema_version": "1.0.0",
  "stable_key": "strawberries-2026-08-07-full-location",
  "name": "Strawberries — August 7, 2026 full-location replay",
  "captured_at": "2026-08-07T05:17:05Z",
  "product_pack": {
    "id": "fresh_strawberries",
    "version": "1.0.0"
  },
  "analysis_config": {
    "id": "historical-strawberries-2026-08-07",
    "name": "Historical Strawberries — August 7, 2026",
    "version": "1.0.0",
    "enabled": true,
    "benchmark_retailer": "walmart_us",
    "product_pack": {
      "id": "fresh_strawberries",
      "version": "1.0.0"
    },
    "retailers": [
      {
        "retailer_id": "walmart_us",
        "enabled": true
      },
      {
        "retailer_id": "aldi_us",
        "enabled": true
      },
      {
        "retailer_id": "amazon_us_same_day",
        "enabled": true
      }
    ],
    "analysis": {
      "comparison_profiles": ["strict", "unit_price", "aldi_10mi"],
      "enable_ai_fallback": false,
      "enable_proximity_validation": true
    },
    "delivery": {
      "web_report": true,
      "excel": true,
      "leadership_email": true,
      "audit_package": true
    }
  },
  "artifacts": [
    {
      "ordinal": 0,
      "retailer_id": "walmart_us",
      "adapter_id": "historical_metricscart_search_monitor_csv",
      "source_name": "Strawberries___Walmart_All_Stores_20260807_051705.csv",
      "source_format": "metricscart_search_monitor_csv",
      "content_type": "text/csv",
      "expected_sha256": "88e52f004d2b6a8852342a1be348f4d5a58352270f748751e83b5710d6b2ae10",
      "expected_rows": 192681
    },
    {
      "ordinal": 1,
      "retailer_id": "aldi_us",
      "adapter_id": "historical_metricscart_search_monitor_csv",
      "source_name": "Strawberries___Aldi_All_Stores_20260807_051534.csv",
      "source_format": "metricscart_search_monitor_csv",
      "content_type": "text/csv",
      "expected_sha256": "eda261966da7f75f3dcdcf460956f7bbf71a301d0a4e33aa002e6c255bb25f4b",
      "expected_rows": 37940
    },
    {
      "ordinal": 2,
      "retailer_id": "amazon_us_same_day",
      "adapter_id": "historical_metricscart_consolidated_serp_csv",
      "source_name": "strawberries_amazon.csv",
      "source_format": "metricscart_consolidated_serp_csv",
      "content_type": "text/csv",
      "expected_sha256": "6781f3da75365eeb5b3e075fc271cf97bf6389021e54eb57b2282c90ba80765b",
      "expected_rows": 66822
    }
  ],
  "metadata": {
    "source_rows_total": 297443,
    "purpose": "Full-source strawberry golden replay"
  }
}
